{"bench_version":"0.3.1","campaigns":[{"first_line_at":"2026-10-27T21:51:57Z","generation_hash":"d2438fd2e24e99ad017e8f045adb81021a5cd3563f421bef4a76ea8656a3897b","id":"admission-20261026","last_line_at":"2026-10-29T05:35:23Z","ollama_version":"0.40.5","status":"partial"},{"first_line_at":"2026-10-20T20:33:17Z","generation_hash":"3eadf4dd371ea51596a6ce4b4332cbf0f90811f7183ab9f888b17c44435eb606","id":"full-20261018","last_line_at":"2026-10-27T19:42:29Z","ollama_version":"0.40.5","status":"partial"},{"first_line_at":"2026-10-29T06:56:12Z","generation_hash":"43c89a46794e0aed414e104e83351a0eef75bd57f9f1c967d37a104157123158","id":"lfm3-20261029","last_line_at":"2026-10-29T12:24:20Z","ollama_version":"0.40.13","status":"complete"}],"machines":[{"gpu":"NVIDIA GeForce RTX 3050","id":"tour-rtx3050","label":"tour-rtx3050","os":"Windows 11","ram_mib":31861,"vram_mib":8192}],"models":[{"capabilities":["chat","tools","thinking"],"context_length":131072,"digest":"83f596831da1869c694b67b8d1c0978dddebf07599b663453befbdd953bfdcea","editor":"Liquid AI","family":"lfm","moe":false,"name":"LFM 2.5 2.6B","office_use":null,"params_active_b":2.7,"params_total_b":2.7,"sources":[{"date":"2026-10-18","note":"fiche non rouverte au relevé : valeurs à confirmer par ollama show","ref":"https://huggingface.co/LiquidAI/LFM2.5-2.6B"}],"tag":"LiquidAI/lfm2.5-2.6b"},{"capabilities":["chat","tools","thinking"],"context_length":262144,"digest":"d3053a5d5f81605e54a03740c7331d131617a741140fe1156e39e5f7231d1991","editor":"PrismML","family":"bonsai","moe":false,"name":"Bonsai 27B (1 bit)","office_use":null,"params_active_b":27.0,"params_total_b":27.0,"sources":[{"date":"2026-10-18","note":"fiche non rouverte au relevé : valeurs à confirmer par ollama show","ref":"https://ollama.com/library/bonsai"},{"date":"2026-10-27","note":"généré dans admission-20261026 et non plus dans full-20261018 (arrêtée après granite4.2:8b)","ref":"décision d'Anaël du 2026-10-27"}],"tag":"bonsai:27b-q1_0"},{"capabilities":["chat","tools","thinking"],"context_length":65536,"digest":"4f22875738aab3a85eb2f3147acd6366006323310aadfaf84a9265e2ea7345b4","editor":"PrismML","family":"bonsai","moe":false,"name":"Bonsai 8B (1 bit)","office_use":null,"params_active_b":8.0,"params_total_b":8.0,"sources":[{"date":"2026-10-18","note":"fiche non rouverte au relevé : valeurs à confirmer par ollama show","ref":"https://ollama.com/library/bonsai"}],"tag":"bonsai:8b-q1_0"},{"capabilities":["chat","tools","thinking"],"context_length":262144,"digest":"cddd549bcb687a902b0ffb582cb39d8c2c3e72cff44599449e1f6c099edc5b45","editor":"Google","family":"gemma","moe":false,"name":"Gemma 4 12B (Unsloth IQ3_XXS)","office_use":null,"params_active_b":11.9,"params_total_b":11.9,"sources":[{"date":"2026-10-18","ref":"catalogue figé de wavelocalai ee472c8 (gemma4-ud:12b-iq3_xxs)"},{"date":"2026-10-27","note":"généré dans admission-20261026 et non plus dans full-20261018 (arrêtée après granite4.2:8b)","ref":"décision d'Anaël du 2026-10-27"}],"tag":"gemma4-ud:12b-iq3_xxs"},{"capabilities":["chat","tools","thinking","vision","audio"],"context_length":131072,"digest":"07ea59a474013479c8b6b802bef095c40e964a1d776ba02f264c0e30e1aede0c","editor":"Google","family":"gemma","moe":false,"name":"Gemma 4 E2B (QAT)","office_use":null,"params_active_b":2.0,"params_total_b":4.6,"sources":[{"date":"2026-10-18","note":"fiche non rouverte au relevé : valeurs à confirmer par ollama show","ref":"https://ollama.com/library/gemma4"},{"date":"2026-10-18","note":"plongements par couche : 4,6B avec eux, ~2B effectifs ; dense, donc moe false","ref":"catalogue figé de wavelocalai ee472c8 (gemma4:e2b-it-qat)"}],"tag":"gemma4:e2b-it-qat"},{"capabilities":["chat","tools","thinking","vision","audio"],"context_length":131072,"digest":"ee665637121887cf3befff38abbb1be4ee117c7db867d97a67e29049ecd7e15f","editor":"Google","family":"gemma","moe":false,"name":"Gemma 4 E4B (QAT)","office_use":null,"params_active_b":4.0,"params_total_b":8.0,"sources":[{"date":"2026-10-18","note":"fiche non rouverte au relevé : valeurs à confirmer par ollama show","ref":"https://ollama.com/library/gemma4"},{"date":"2026-10-18","note":"plongements par couche : 8B avec eux, ~4B effectifs ; dense, donc moe false","ref":"catalogue figé de wavelocalai ee472c8 (gemma4:e4b-it-qat)"}],"tag":"gemma4:e4b-it-qat"},{"capabilities":["chat","tools","thinking"],"context_length":131072,"digest":"40577dc168a3a9ad34e9a1234e0c2570be86097fa75a236d4574ae985705d3c4","editor":"IBM","family":"granite","moe":false,"name":"Granite 4.2 3B","office_use":null,"params_active_b":3.7,"params_total_b":3.7,"sources":[{"date":"2026-10-18","note":"fiche non rouverte au relevé : valeurs à confirmer par ollama show","ref":"https://ollama.com/library/granite4.2"}],"tag":"granite4.2:3b"},{"capabilities":["chat","tools","thinking"],"context_length":131072,"digest":"f586c02fdecdf151b656207c339aa003997345774a41768bac1fd6d2fb85913b","editor":"IBM","family":"granite","moe":false,"name":"Granite 4.2 8B","office_use":{"decided":"2026-10-29","fit":false,"reason":"trop lent et sans marge mémoire : 31,4 h projetées, débordement du GPU dès le palier 8 192"},"params_active_b":8.8,"params_total_b":8.8,"sources":[{"date":"2026-10-18","note":"fiche non rouverte au relevé : valeurs à confirmer par ollama show","ref":"https://ollama.com/library/granite4.2"}],"tag":"granite4.2:8b"},{"capabilities":["chat","tools"],"context_length":32768,"digest":"5eee845b49c4b72ef9e385463a1e2ea9f6f937e08b019f3bbecec12bc1927221","editor":"IBM","family":"granite","moe":false,"name":"Granite 4.0 350M","office_use":null,"params_active_b":0.352,"params_total_b":0.352,"sources":[{"date":"2026-10-18","note":"architecture granite, 352.38M, dense, contexte 32768, BF16, sans thinking, Apache 2.0, digest 5eee845b49c4","ref":"ollama show (Ollama 0.40.5, tour-rtx3050)"}],"tag":"granite4:350m"},{"capabilities":["chat","tools"],"context_length":524288,"digest":"2e334d42ac17a07fb7e6447dd5c98d0c501d4f90bef900cc57fd3f6cd067dd2c","editor":"Institute of Foundation Models (MBZUAI)","family":"k2horizon","moe":false,"name":"K2 Horizon 3.7B","office_use":null,"params_active_b":3.7,"params_total_b":3.7,"sources":[{"date":"2026-10-26","note":"campagne admission-20261026 (décision d'Anaël du 2026-10-26) ; dense 3,7B, Apache 2.0, contexte annoncé 524 288, raisonnement, 3,16 Go (fichier K2-Horizon-4B-Q4_K_M.gguf), sorti le 2026-09-03 ; langue déclarée : anglais seulement ; indice Artificial Analysis v4.3.2 : 16 (variante reasoning) ; très verbeux (180 M tokens sur l'indice AA, médiane 74 M) ; capacités et paramètres à vérifier par ollama show","ref":"https://huggingface.co/IFM/K2-Horizon-3.7B-GGUF"},{"date":"2026-10-26","note":"capacités chat, tools, thinking ; même fichier K2-Horizon-4B-Q4_K_M.gguf","ref":"catalogue figé de wavelocalai ee472c8 (K2 Horizon 3.7B, k2-horizon:3.7b-q4_k_m)"},{"date":"2026-10-26","note":"architecture k2-horizon lue depuis Ollama 0.40.4 (3.7B Q4_K_M confirmé, issue fermée le 2026-10-14)","ref":"https://github.com/ollama/ollama/issues/18698"}],"tag":"hf.co/IFM/K2-Horizon-3.7B-GGUF:Q4_K_M"},{"capabilities":["chat","tools","vision","audio"],"context_length":65536,"digest":"7988467f401fe587ad07fb7953f317bde40afb3a00a71ad9f359289f0eef477f","editor":"NVIDIA","family":"nemotron","moe":false,"name":"Nemotron 3.5 Bolt E4B","office_use":null,"params_active_b":4.0,"params_total_b":8.0,"sources":[{"date":"2026-10-24","note":"campagne admission-20261026 (décision d'Anaël du 2026-10-24, déplacée le 2026-10-26 depuis bonsai2-20261023) ; réentraînement par NVIDIA de Gemma 4 E4B-it, 8B au total et 4B effectifs, dense, contexte 64K annoncé, texte seul, 4,76 Go (UD-Q4_K_XL), publié le 2026-10-23, OpenMDW-1.1 et Apache 2.0 ; moe false, paramètres 8,0 au total et 4,0 effectifs et « dense » DÉDUITS de la fiche (à vérifier par ollama show ; moe doit rester un booléen) ; capacités tools et thinking déduites de la fiche (raisonnement activable, enable_thinking) : à vérifier par ollama show","ref":"https://huggingface.co/unsloth/NVIDIA-Nemotron-3.5-Bolt-E4B-GGUF"},{"date":"2026-10-24","note":"famille nemotron par l'éditeur, base Gemma 4","ref":"https://unsloth.ai/docs/models/nemotron-3.5-bolt"}],"tag":"hf.co/unsloth/NVIDIA-Nemotron-3.5-Bolt-E4B-GGUF:UD-Q4_K_XL"},{"capabilities":["chat","tools","thinking"],"context_length":131072,"digest":"95bd9d45385f33bfe96d8b3651c8569e152f21f5bdb7c19894ffde650e9cf140","editor":"Liquid AI","family":"lfm","moe":false,"name":"LFM 2.5 1.2B Thinking","office_use":null,"params_active_b":1.2,"params_total_b":1.2,"sources":[{"date":"2026-10-18","note":"fiche non rouverte au relevé : valeurs à confirmer par ollama show","ref":"https://ollama.com/library/lfm2.5-thinking"}],"tag":"lfm2.5-thinking:1.2b"},{"capabilities":["chat","tools","thinking"],"context_length":128000,"digest":"9cf756159fc2f3b9128c6a3f544ec90c5e9b8afdbb4179a57b8aea9de589cfb2","editor":"Liquid AI","family":"lfm","moe":true,"name":"LFM 2.5 8B-A1B","office_use":null,"params_active_b":1.5,"params_total_b":8.5,"sources":[{"date":"2026-10-18","note":"fiche non rouverte au relevé : valeurs à confirmer par ollama show","ref":"https://ollama.com/library/lfm2.5"},{"date":"2026-10-18","ref":"catalogue figé de wavelocalai ee472c8 (lfm2.5:8b-a1b-q4_K_M)"}],"tag":"lfm2.5:8b-a1b-q4_K_M"},{"capabilities":["chat","tools","vision","audio","speech"],"context_length":128000,"digest":"4c0ee9400634babb880868b873bcebf09fbbf1a5328e550bdbaff25888f1f7e2","editor":"Liquid AI","family":"lfm","moe":false,"name":"LFM3 Omni 2B","office_use":null,"params_active_b":1.73,"params_total_b":1.73,"sources":[{"date":"2026-10-29","note":"campagne lfm3-20261029 ; omnimodal (texte, image, audio, parole) sur le cœur de 1,73 milliard de LFM3 1.7B, 2,0 Go ; capacités de /api/show : completion, vision, audio, speech, tools, SANS thinking (piste think_off seule) ; seul le texte est évalué","ref":"https://ollama.com/library/lfm3-omni"},{"date":"2026-10-29","ref":"https://huggingface.co/collections/LiquidAI/lfm3"}],"tag":"lfm3-